{
  "schemaVersion": 12,
  "id": "bangkok-2026",
  "name": "曼谷 8日7夜 2026",
  "shortName": "曼谷 2026・8日7夜",
  "subtitle": "On Nut 美食・夜市・Outlet・按摩之旅",
  "startDate": "2026-08-29",
  "endDate": "2026-09-05",
  "timezone": "Asia/Bangkok",
  "country": "泰國・曼谷",
  "features": {
    "itinerary": true,
    "tripInfo": true,
    "attractions": true,
    "liveCam": false,
    "todayMode": true,
    "drivingMode": false,
    "weather": true,
    "weatherScore": true,
    "weatherActivityProfiles": true,
    "packingChecklist": true,
    "winterDriving": false
  },
  "modules": [],
  "pages": {
    "itinerary": "itinerary.html",
    "tripInfo": "trip-info.html",
    "attractions": "attractions.html",
    "liveCam": "live.html"
  },
  "dataFiles": {
    "itinerary": "itinerary.json",
    "tripInfo": "trip-info.json",
    "hotels": "hotels.json",
    "attractions": "attractions.json",
    "liveCams": "live-cams.json",
    "weather": "weather.json",
    "departureChecklist": "departure-checklist.json"
  },
  "renderers": {
    "itinerary": {
      "mode": "generate",
      "source": "itinerary"
    },
    "tripInfo": {
      "mode": "generate",
      "source": "tripInfo"
    },
    "attractions": {
      "mode": "generate",
      "source": "attractions"
    },
    "liveCam": {
      "mode": "generate",
      "source": "liveCams"
    },
    "weather": {
      "mode": "generate",
      "source": "weather",
      "profileStandard": "v1",
      "useActivityProfiles": true
    },
    "todayMode": {
      "mode": "generate",
      "source": "itinerary"
    },
    "drivingMode": {
      "mode": "generate",
      "source": "itinerary"
    }
  },
  "photoCredits": [
    {
      "label": "On Nut Road（Thanon On Nut）",
      "url": "https://commons.wikimedia.org/wiki/File:Thanon_On_Nut.jpg"
    },
    {
      "label": "BTS On Nut Station",
      "url": "https://commons.wikimedia.org/wiki/File:BTS_On_Nut_Station_20151107.jpg"
    },
    {
      "label": "Bangkok Airport（Bkk airport）",
      "url": "https://commons.wikimedia.org/wiki/File:Bkk_airport.jpg"
    },
    {
      "label": "Chatuchak Weekend Market",
      "url": "https://commons.wikimedia.org/wiki/File:Chatuchak_Weekend_Market.jpg"
    },
    {
      "label": "Chatuchak Weekend Market 2",
      "url": "https://commons.wikimedia.org/wiki/File:Chatuchak_Weekend_Market_2.jpg"
    },
    {
      "label": "Chatuchak Weekend Market P1100757",
      "url": "https://commons.wikimedia.org/wiki/File:Chatuchak_Weekend_Market_P1100757.JPG"
    },
    {
      "label": "Yaowarat Road at night",
      "url": "https://commons.wikimedia.org/wiki/File:Yaowarat_Road_at_night.jpg"
    },
    {
      "label": "Yaowarat at night",
      "url": "https://commons.wikimedia.org/wiki/File:Yaowarat_at_night_(32455695783).jpg"
    },
    {
      "label": "Yaowarat Road",
      "url": "https://commons.wikimedia.org/wiki/File:Yaowarat_road.jpg"
    },
    {
      "label": "MBK Center・New facade",
      "url": "https://commons.wikimedia.org/wiki/File:MBK_Center_(New_facade).jpg"
    },
    {
      "label": "MBK Center Level 2",
      "url": "https://commons.wikimedia.org/wiki/File:MBK_Center_Level_2_201801.jpg"
    },
    {
      "label": "MBK Bangkok Night",
      "url": "https://commons.wikimedia.org/wiki/File:MBK_Bangkok_Night.jpg"
    },
    {
      "label": "Terminal 21 Asok・132423",
      "url": "https://commons.wikimedia.org/wiki/File:Terminal_21_Asok_20251228_132423.jpg"
    },
    {
      "label": "Terminal 21 Asok・132317",
      "url": "https://commons.wikimedia.org/wiki/File:Terminal_21_Asok_20251228_132317.jpg"
    },
    {
      "label": "Terminal 21 Asok・20250325",
      "url": "https://commons.wikimedia.org/wiki/File:Terminal_21_Asok_(20250325155701).jpg"
    },
    {
      "label": "Samut Prakan Crocodile Farm and Zoo・267",
      "url": "https://commons.wikimedia.org/wiki/File:Samutprakan_Crocodile_Farm_and_Zoo_in_2019_(267).jpg"
    },
    {
      "label": "Samut Prakan Crocodile Farm and Zoo・287",
      "url": "https://commons.wikimedia.org/wiki/File:Samutprakan_Crocodile_Farm_and_Zoo_in_2019_(287).jpg"
    },
    {
      "label": "Samut Prakan Crocodile Farm and Zoo・216",
      "url": "https://commons.wikimedia.org/wiki/File:Samutprakan_Crocodile_Farm_and_Zoo_in_2019_(216).jpg"
    },
    {
      "label": "Wat Paknam・Big Buddha",
      "url": "https://commons.wikimedia.org/wiki/File:Big_Buddha_at_Wat_Pak_Nam_Phasi_Charoen_Bangkok_Thailand_by_Don_Ramey_Logan.jpg"
    },
    {
      "label": "Wat Paknam・Chedi Maha Rajamongkol",
      "url": "https://commons.wikimedia.org/wiki/File:Chedi_Maha_Rajamongkol_of_Wat_Paknam.jpg"
    },
    {
      "label": "ICONSIAM outside",
      "url": "https://commons.wikimedia.org/wiki/File:ICONSIAM_outside.jpg"
    }
  ]
}
