{
  "schemaVersion": 12,
  "id": "city-demo",
  "name": "City Demo",
  "shortName": "City Demo",
  "subtitle": "最少資料 Trip，驗證同一套 renderer",
  "startDate": "2028-06-10",
  "endDate": "2028-06-11",
  "timezone": "Asia/Tokyo",
  "country": "Demo",
  "features": {
    "itinerary": true,
    "tripInfo": true,
    "attractions": true,
    "liveCam": false,
    "todayMode": true,
    "drivingMode": false,
    "weather": true,
    "weatherScore": true,
    "weatherActivityProfiles": true,
    "packingChecklist": false,
    "winterDriving": false
  },
  "modules": [],
  "pages": {
    "itinerary": "itinerary.html",
    "tripInfo": "trip-info.html",
    "attractions": "attractions.html",
    "liveCam": "live.html"
  },
  "dataFiles": {
    "itinerary": "itinerary.json",
    "tripInfo": "trip-info.json",
    "hotels": "hotels.json",
    "attractions": "attractions.json",
    "weather": "weather.json"
  },
  "renderers": {
    "itinerary": {
      "mode": "generate",
      "source": "itinerary"
    },
    "tripInfo": {
      "mode": "generate",
      "source": "tripInfo"
    },
    "attractions": {
      "mode": "generate",
      "source": "attractions"
    },
    "liveCam": {
      "mode": "generate",
      "source": "liveCams"
    },
    "weather": {
      "mode": "generate",
      "source": "weather",
      "profileStandard": "v1"
    },
    "todayMode": {
      "mode": "generate",
      "source": "itinerary"
    },
    "drivingMode": {
      "mode": "generate",
      "source": "itinerary"
    }
  }
}
