{
  "schemaVersion": 12,
  "id": "golden-reference-2027",
  "name": "白川鄉・新穗高 2027 Golden Reference",
  "shortName": "白川鄉・新穗高 2027",
  "subtitle": "日本中部冬季自駕・Standard Renderer POC",
  "startDate": "2027-01-09",
  "endDate": "2027-01-17",
  "timezone": "Asia/Tokyo",
  "country": "日本",
  "features": {
    "itinerary": true,
    "tripInfo": true,
    "attractions": true,
    "liveCam": true,
    "todayMode": true,
    "drivingMode": true,
    "weather": true,
    "weatherScore": true,
    "weatherActivityProfiles": true,
    "packingChecklist": true,
    "winterDriving": true
  },
  "modules": [],
  "pages": {
    "itinerary": "itinerary.html",
    "tripInfo": "trip-info.html",
    "attractions": "attractions.html",
    "liveCam": "live.html"
  },
  "dataFiles": {
    "itinerary": "itinerary.json",
    "tripInfo": "trip-info.json",
    "hotels": "hotels.json",
    "attractions": "attractions.json",
    "liveCams": "live-cams.json",
    "weather": "weather.json",
    "departureChecklist": "departure-checklist.json"
  },
  "renderers": {
    "itinerary": {
      "mode": "generate",
      "source": "itinerary"
    },
    "tripInfo": {
      "mode": "generate",
      "source": "tripInfo"
    },
    "attractions": {
      "mode": "generate",
      "source": "attractions"
    },
    "liveCam": {
      "mode": "generate",
      "source": "liveCams"
    },
    "weather": {
      "mode": "generate",
      "source": "weather",
      "profileStandard": "v1"
    },
    "todayMode": {
      "mode": "generate",
      "source": "itinerary"
    },
    "drivingMode": {
      "mode": "generate",
      "source": "itinerary"
    }
  }
}
